"Title","Caption","Copyright","Node Type"
"Like Taj Mahal, Humayun’s Tomb gets Egyptian lamps","Facade, scaffolding from roof","AKDN/Christian Richters","In the media"
"Aga Khan Hospital joins the top league","In 2005, the AKU Hospital, Nairobi, was created as a teaching hospital. Postgraduate medical education is already in place, in Nairobi and Dar es Salaam. The Hopital's aim is to be a premier tertiary care facility for Eastern Africa. ","AKDN / Gary Otte","In the media"
"Aga Khan Awards announced ","His Highness the Aga Khan addresses the audience during the award ceremony of the 12th cycle of the Aga Khan Award for Architecture, presented in Lisbon, Portugal. ","AKDN / Gary Otte","In the media"
"AKU introduces ‘Care of the Elderly’ ","Founded by His Highness the Aga Khan and chartered in 1983 as Pakistan's first private university, Aga Khan University's (AKU) objective is to promote human welfare in general, and the welfare of the people of Pakistan in particular, by disseminating knowledge and providing instruction, training, research and service in the health sciences, education and such other branches of learning as the University may determine. ","AKDN/Garry Otte","In the media"
"Aga Khan revives lost 16th century Mughal garden in heart of Delhi","Pathway along main axis connecting the entrance gate to the Humayun's Tomb ","AKDN/AKTC","In the media"
"AKUH introduces anticoagulation clinic","Founded by His Highness the Aga Khan and chartered in 1983 as Pakistan's first private university, Aga Khan University's (AKU) objective is to promote human welfare in general, and the welfare of the people of Pakistan in particular, by disseminating knowledge and providing instruction, training, research and service in the health sciences, education and such other branches of learning as the University may determine. ","AKDN/Garry Otte","In the media"
"Self-sustaining projects aim to fight global poverty","The annual World Partnership Walk at Stanley Park in Vancouver, British Columbia, Canada, Sunday May 26, 2013.
","AKDN","In the media"
"Dar’s Aga Khan Hospital turns to specialty in neurosciences","MRI scanner at the Aga Khan Hospital, Dar es Salaam, Tanzania.","AKDN / Jean-Luc Ray","In the media"
"Mughal era tombs restored to their traditional grandeur ","Isa Khan Niyazi Tomb Complex, facade ","AKDN/Christian Richters","In the media"
"Exhibition of facsimile prints on Mughals Arts, Culture and Empire held in Kabul","Opening day 12 May 2013 at the Queen's Palace, Bagh-e Babur ","AKDN/Katrin Lotz","In the media"
"Breathing life into Hyderabad’s Qutb Shahi tombs","Qutb Shahi Tombs","AKDN/Luis Monreal","In the media"
"Aga Khan University opens new health centre in Arusha","Honourable Stanslaus Mageso Mulongo, Regional Commissioner in Arusha cuts the ribbon to mark the official opening of the Aga Khan Health Centre in Arusha. ","AKU","In the media"
"Aga Khan opens health centre in Arusha","The Aga Khan Health Centre in Arusha.","AKU","In the media"
"AKU receives international recognition in medical education","Aga Khan University. A woman in white - doctor or nurse - walks past a fountain at the medical college. ","AKDN/Jean-Luc Ray","In the media"
"One year on: Bujagali Doubles power supply","Aerial view of the Bujagali Hydropower Project.","Matthias Mugisha    ","In the media"
"Bujagali performing beyond expectation – management","BEL has worked with the Government of Uganda and tour operators to develop additional tourist facilities in the downstream Kalagala Falls area. The lake that has formed behind the dam has also created new leisure and tourism activities, including popular sunset cruises and bird watching tours. Tourism has risen 10%, according to local tour operators. ","Matthias Mugisha","In the media"
"FOCUS in collaboration with CoES sets up Interdisciplinary Disaster Response Team in GBAO","The valley of the Murghob river in Tajikistan is prone to natural disasters as a future earthquake may cause landslides or even breach the natural Usoi dam that forms Lake Sarez, unleashing about 17 cubic kilometres of water down the valley. For this reason, Focus humanitarian assistance operates a number of disaster preparedness programmes. In this photo, people are walking across a footbridge built by Focus after its formal inauguration. The bridge was built to give villagers access to other areas. ","AKDN / Jean-Luc Ray ","In the media"
"Teaching the teachers","The Academy in Hyderabad hosts its first IB workshop, welcoming over 100 teachers to its campus.","AKDN","In the media"
"Aga Khan to construct varsity for East Africa","Arusha campus site, Tanzania.","AKU","In the media"
"Éducation nationale : La centrale d’Azito offre trois salles de classe et réhabilite le centre de santé d’Affikro","In the Ivory Coast, a US$ 225-million plant built by
AKFED and its partners in Abidjan provides 30 percent
of the electricity needs of the country.","AKDN","In the media"
"Now, MYP is recognised","The Academy in Hyderabad hosts its first IB workshop, welcoming over 100 teachers to its campus.","AKDN","In the media"
"How Afghanistan is on the leading edge of a tech revolution","Outside the main Roshan shop in Kabul, customers who have just bought mobile phones and Sim Cards, test them. ","AKDN/Jean-Luc Ray ","In the media"
"Escaping Pakistan's poverty trap","An irrigation channel, pipe siphon and land development project of the Aga Khan Rural Support Programme (AKRSP) in Narthang, Baltistan (Pakistan). Planting of poplar trees is the first stage of land development after irrigation channels have been built, transforming the desert landscape.  ","Robin Oldacre-Reed ","In the media"
"Aga Khan Development Network presented its education initiatives to the Parliament of the Kyrgyz Republic","Aga Khan School, Osh, Kyrgyz Republic.","AKDN / Mikhail Romanyuk","In the media"
"The service provider spectrum - from microfinance to financial inclusion","Seen here is a farmer weeding a MSDSP demonstration field in Tavdem. He is dressed in gray pants and a blue shirt and is wearing a cap. He is using a long shovel. In the field in front of him, tomatoes and cabbages are growing. Tajikistan 
","AKDN/Jean-Luc Ray","In the media"
"Roshan to rollout 3G and bring high speed data services to the country","Outside the main Roshan shop in Kabul, people line up to buy mobile phones and Sim Cards.","AKDN/Jean-Luc Ray","In the media"
"How walking can help a child in need ","The World Partnership Walk 2012 in Toronto.","AKDN / Akber Dewji","In the media"
"Hospital programme seeks to improve health communication","
The Aga Khan Health Care Centre in Mwanza is one of several primary health service facilities operated by the Aga Khan Health Services in Tanzania. ","AKDN / Lucas Cuervo Moura ","In the media"
"Hospital under construction to offer 8,000 jobs to Tanzanians","Remote teachers can request assistance by uploading text messages to Moodle (a virtual learning environment) through which faculty can track comments and provide support.","AKDN / Jean-Luc Ray","In the media"
"UCA signs partnership agreement with Kyrgyz Ministry of Finance","The School of Professional and Continuing Education (SPCE) in Khorog, Tajikistan. The University of Central Asia operates continuing education courses at each of its three campuses, in Khorog, Tajikistan; Naryn, Kyrgyz Republic; and Tekeli, Kazakhstan","AKDN / Jean-Luc Ray","In the media"
"Socio-economic development through cultural revitalization","Shigar Fort, 2006 Winner of the UNESCO Asia-Pacific Heritage Award of Excellence. 
","AKDN / Gary Otte","In the media"
"Advanced Emergency Response Management Training held in Afghanistan","In Afghanistan's Badakhshan province, FOCUS has been teaching local people how to effectively form and mobilise community emergency response teams.","FOCUS","In the media"
"Aga Khan health project brings hope to 2 regions	","There is significant investment in human resource development at every level of each AKHS national service company. In the neonatal ward at The Aga Khan Hospital, Dar es Salaam – managed by the Aga Khan Health Service, Tanzania – a nurse attends to an infant born prematurely at 32 weeks. The hospital is a multi-specialty 24-hour medical facility, providing comprehensive outpatient, emergency, inpatient, diagnostic and treatment services","AKDN / Jean-Luc Ray","In the media"
"The art of restoration","The central water channel and pool in the gardens of Humayun’s Tomb complex in Delhi were restored by AKTC in 2003. ","AKTC ","In the media"
"East Africa: Aga Khan to Boost Arusha's Image","His Highness the Aga Khan and Ambassador Richard Sezibera, Secretary General of the East African Community, exchange folders and share congratulations during the signing ceremony.
 ","AKDN / Zahur Ramji","In the media"
"Parc national du Mali : La modernité au flanc de Koulouba","The garden spaces feature indigenous flora in varied settings, from open lawn areas to flower gardens, wooded areas and a medicinal garden.","AKTC","In the media"
"Diabète, cancers et maladies cardiovasculaires ","President Kibaki and the Aga Khan — together with the Deputy Prime Minister, the Minister of Health and others — appraise newly installed cancer equipment at the Heart and Cancer Centre. Patients, doctors, students and researchers at the $50-million facility will benefit from state-of-the-art medical technology.","AKDN / Aziz Islamshah","In the media"
"Tajik Ministry of education approves Early Childhood Education Curriculum","Pre-school creche, Murghab town. The children are dressed in warm clothes and bonnets because of lack of heating. Good facilities. Chairs and tables made for young children. Early Childhood Education. Young Children and the Family.","AKDN/Jeremy Greenland ","In the media"
"Aga Khan Trust for Culture waiting to kick off facelift work at tombs","The Quli Qutb Shah Archaeological Park includes 70 structures, encompassing 40 mausoleums, 23 mosques, five step-wells/water structures, a hamam (mortuary bath), pavilions, garden structures and enclosure walls built during the reign of the Qutb Shahi Dynasty that ruled the Hyderabad region for 170 years in the 16th and 17th centuries.","AKTC / India","In the media"
"Restoring the past glory","The central water channel and pool in the gardens of Humayun’s Tomb complex in Delhi were restored by AKTC in 2003. ","AKTC ","In the media"
"Foundation stone laying ceremony of a public hospital held in Bamyan","Bamyan Provincial Hospital, Afghanistan. ","New Zealand Ministry of Foreign Affairs and Trade","In the media"
"Global poverty – The single biggest challenge of our time","Participants of the 2012 World Partnership Walk in Vancouver, Canada. World Partnership Walk's fight against global poverty.","AKDN","In the media"
"Roshan brings home the prestigious World Communications Award for Best Customer Care","Inside the Roshan Head Office, a young employee counts Sim Cards. ","AKDN/Jean-Luc Ray ","In the media"
"Aga Khan Trust signs Sh1.7bn deal with State for City Park’s facelift ","From left to right, Prince Hussain Aga Khan, Prime Minister of Kenya Raila Odinga, His Highness the Aga Khan and Luis Monreal, General Manager of the Aga Khan Trust for Culture, viewing a scale model of Nairobi City Park. ","AKDN / Samwell Nyakondo","In the media"
"Symposium on trade between Afghanistan and Central Asia","Mr. Azizullah Stanikzai, Deputy General Director of Trade and Investment in the Afghan Ministry of Foreign Affairs, engaging in a discussion during UCA's  symposium on ""Trade and Cooperation between Central Asia and Afghanistan"". Mr. Stanikzai also participated in UCA's 10-day trade policy and negotiations training programme in Issyk-kul, Kyrgyz Republic, held in August 2012.","Aziz Jan / UCA","In the media"
"Chaunsath Khambha to stand tall again","The central water channel and pool in the gardens of Humayun’s Tomb complex in Delhi were restored by AKTC in 2003. ","AKTC ","In the media"
"Timur Shah Mausoleum officially opened in Kabul","President Karzai and the Aga Khan unveil a plaque commemorating the restoration of the mausoleum of Timur Shah. ","AKDN / Gary Otte","In the media"
"Aga Khan inaugurate construction of obstetrics facility in Kabul","His Highness the Aga Khan speaking at the foundation ceremony for the new Women's Wing at FMIC as Afghanistan's Vice President, Mohammad Karim Khalili, and Foreign Minister Laurent Fabius of France look on.","AKDN / Gary Otte","In the media"
"Roshan brings home to Afghanistan three prestigious Stevie International Business Awards","Outside view of Roshan heaed office in Kabul.","AKDN/Jean-Luc Ray ","In the media"
"Saxon and Serena hotels triumph at World Travel Awards ","Kigali Serena Hotel, Rwanda. ","AKDN","In the media"
"Lasting monuments","The restoration works carried out between November 2004 and June 2006 were conducted in strict observance of traditional construction techniques. Further initiatives of this kind are planned, notably in Djenné and Timbuktu.","","In the media"
"Museveni, Aga Khan set to launch Bujagali ","His Highness the Aga Khan and President Yoweri Museveni of Uganda plant a tree at the inauguration of the Bujagali power plant. ","AKDN / Gary Otte","In the media"
"Museveni commissions Nyagak hydropower plant","Nyagak I hydropower station in Paidha, Zombo District, Uganda","","In the media"
"Construction begins on Canadian-funded hospital in Afghanistan","Foundation Laying Ceremony of the new Bamyan Provincial Hospital (BPH), 18 April 2013, Bamyan, Afghanistan.","","In the media"
