"Title","Caption","Copyright","Node Type"
"Aga Khan Hospital opens heart surgery laboratory","The Aga Khan Hospital, Dar es Salaam. ","AKDN / Jean-Luc Ray ","In the media"
"German govt and Aga Khan Development Network inaugurate Safe Drinking Water and Sanitation schemes","The projects of the Water and Sanitation Extension Programme (WASEP) in Pakistan, like this water filtration system in Gilgit-Baltistan, are being replicated with the support of governments, donors and partners.","AKDN","In the media"
"Aga Khan University to train teachers","Remote teachers can request assistance by uploading text messages to Moodle (a virtual learning environment) through which faculty can track comments and provide support.","AKDN / Jean-Luc Ray","In the media"
"Building on faith: Inside Toronto’s new Aga Khan Museum, designed by the world’s leading architects","The Aga Khan Museum in Toronto.","AKDN / Zahur Ramji","In the media"
"Residents applaud foundation for key education project","Community-based Savings Groups (CBSGs) in Nanaganga, Tanzania. ","AKDN / Lucas Cuervo Moura ","In the media"
"Aga Khan Trust for Culture restores the historic Citadel in Herat","The Citadel of Herat - Afghanistan","AKDN","In the media"
"Tile by tile","Humayun's Tomb overview","AKDN/AKTC","In the media"
"Museveni lauds Aga Khan Hospital for good services","AKU campus, Kampala, Uganda","AKDN/Gary Otte","In the media"
"You have one liver, take care of it","In 2005, the AKU Hospital, Nairobi, was created as a teaching hospital. Postgraduate medical education is already in place, in Nairobi and Dar es Salaam. The Hopital's aim is to be a premier tertiary care facility for Eastern Africa. ","AKDN/Garry Otte","In the media"
"UAE donations help fund school project in Afghanistan","AKF focuses on the operation of community-based pre-schools, located in the home of a community member who receives special training in ECD teaching methods. This training is linked to parenting education and mothers' literacy classes","AKDN / Caroline Arnold","In the media"
"Nation Media launches ‘Business Daily’ e-paper","Nation Media Group","AKDN","In the media"
"PM Otorbayev, Aga Khan Development Network Representative discuss AKDN projects in Kyrgyzstan","Aerial view of Phase I construction of Naryn campus buildings, which will include the academic building (front right) and two student dormitory buildings (back left). ","AKDN","In the media"
"The Aga Khan gets North-South Prize","His Excellency Aníbal Cavaco Silva, the President of the Republic of Portugal presents His Highness the Aga Khan with the 2013 North-South Prize.","Photo: AKDN/ José Manuel Boavida Caria","In the media"
"The Lancet: Stitches to save lives","","","In the media"
"Kyrgyzstan: Yurt Preschools Reach Nomadic Children","Jailoo Kindergarten, Kyrgyz Republic.","AKDN","In the media"
"Aga Khan University to expand in East Africa ","A depiction of the Aga Khan University’s future campus in Arusha,Tanzania. The Faculty of Arts and Sciences in Arusha will not only be comparable to Karachi’s campus in size and scope, but it will also be the University’s first permanent campus serving students from all across the East African community.","AKDN","In the media"
"Preserving history: Aga Khan Trust helping restore Royal Bath","Wazir Khan Hammam conservation, Lahore, Pakistan. Designs in the muqarnas ceiling over the central dome are now revealed as part of the conservation process. ","AKTC/Christian Richters","In the media"
"UCA Completes Construction of Khorog Intercity Road to the Dasht Village","The 2.5 km Dasht road handed over to Khorog Municipality and the State Commission Departments is part of several infrastructure projects completed by UCA that contribute to communities neighbouring its future campus site.","UCA/Shavqat Mazabshoev","In the media"
"Aga Khan Health Service launches US$ 55,000 International Healthcare Management Program","The Aga Khan Hospital, Dar es Salaam. ","AKDN / Jean-Luc Ray ","In the media"
"Tajik Badakhshan helps save lives in Afghan Badakhshan","As part of the government programme, AKHS is supporting 18 health facilities in Rushan District, Tajikistan.","AKDN / Jean-Luc Ray","In the media"
"Aga Khan in heart feat","The Aga Khan University Hospital, Nairobi, Kenya. ","AKDN / Zahur Ramji    ","In the media"
"Give children life skills, says varsity boss","Aga Khan Foundation is supporting the creation of locally owned early childhood centres in Kenya, Tanzania and Uganda  fostering pre-school environments in children’s formative years.","AKDN / Zul Mukhida","In the media"
"Aga Khan Hospital Scores Another First Regional Heart Surgery ","The Aga Khan Hospital in Nairobi, Kenya.","AKDN / Zahur Ramji","In the media"
"Barring AKU, no medical college recognised in US ","The Aga Khan University’s Medical College in Karachi, Pakistan.","AKDN / Gary Otte","In the media"
"Aga Khan hospital hosts free breast cancer screening in Dar","MRI scanner at the Aga Khan Hospital, Dar es Salaam, Tanzania.","AKDN / Jean-Luc Ray","In the media"
"Humayun's Tomb set to get site museum ","The restored dome of Humayun's tomb.","AKTC","In the media"
"Parc national rénové, quatre ans et une splendeur intacte","The National Park of Mali in Bamako was developed under a public-private partnership between the Government of Mali and the Aga Khan Trust for Culture (AKTC).","Christian Richters","In the media"
"Aga Khan museum: A global symbol of light, pluralism and culture","Ivory horn (oliphant) : This rare carved ivory tusk is an exceptional example of the dissemination and exchange of visual culture across the eastern Mediterranean among the Fatimids (909–1171), the Byzantine Empire, and the Italian city-states. One of a few examples surviving in major museum collections, it was carved in Sicily or southern Italy, with images derived from Fatimid court culture. The tusk is decorated with a hunting scene comprising real and mythical animals running in file across its length. The exquisite carved decoration on the horn, and the English silver mounts that were added in the seventeenth century, suggest that it may have served a ceremonial role. Its original function is understood by some as a hunting horn and by others as a wine horn. ","AKDN","In the media"
"Aga Khan Museum launched in Canada ","The Museum collection contains some of the greatest artistic achievements of Islamic civilisations. ","Gary Otte / AKDN","In the media"
"UCA IPPA, Tajik IPA launch certificate program on policy analysis","Participants and University of Central Asia’s Institute of Public Policy and Administration (UCA-IPPA) staff engage in discussion.","AKDN / Mikhail Romanyuk ","In the media"
"UCA celebrates 220 graduates from Tajikistan and Afghanistan","English language instructor Nigina Noebshoeva with students at the SPCE in Khorog, Tajikistan. Since it opened in 2006, UCA’s Town Campus in Khorog has buzzed with activity as youth and adult learners alike engage in courses at the School of Professional and Continuing Education (SPCE). The facility is equipped with state-of-the-art learning technologies, computer laboratories, classrooms and a 44,453 volume library. ","UCA / Mikhail Romanyuk ","In the media"
"Humayun's Tomb model for heritage rules","The central water channel and pool in the gardens of Humayun’s Tomb complex in Delhi were restored by AKTC in 2003. ","AKTC ","In the media"
"Aga Khan Museum to open next month","The Aga Khan Museum, Toronto.","AKDN / Gary Otte","In the media"
"Tanzania: Aga Khan Development Network to Invest U.S. $1 Billion (Sh1.6 Trillion)in Expansion Plans for Tanzania","Arusha campus site, Tanzania.","AKU","In the media"
"Civil society groups urged to protect Qutub Shahi Tombs","Qutub Shahi Tombs","AKDN/Luis Monreal","In the media"
"Heritage | After Humayun, who?","The restored dome of Humayun's tomb.","AKTC","In the media"
"More than a place to hang your hat: The Awali Adventure — Day Six","Wildebeest migration in front of Amboseli Serena Lodge and Mount Kilimanjaro ","AKDN","In the media"
"Foundation helped her, now she walks for them","","","In the media"
"Aid to a remote part of Pakistan","","","In the media"
"Top-end hotel fills gap in Kabul","View of new wing under construction of the old and damaged Kabul Hotel, 2003, Afghanistan. The new Kabul Serena Hotel restored by the Tourism and Promotion Services of AKFED, will become part of the Serena chain of hotels.","AKDN / Jean-Luc Ray","In the media"
"Goodwill Ambassador Jolie sees urgency of more aid in Pakistan","Pakistani soldiers are preparing to carry casualties on stretchers out of one of the four AKF helicopters dispatched to the area.","Carlino Luca, Karen SA","In the media"
"Alcan Sustainability Prize Awarded to Pakistani Urban Planning Organization","The projects of the Water and Sanitation Extension Programme (WASEP) in Pakistan, like this water filtration system in Gilgit-Baltistan, are being replicated with the support of governments, donors and partners.","AKDN","In the media"
"Kyrgyz, Afghan and Tajik concert sponsored by Aga Khan Music Initiative","Homayun Sakhi playing rubab. ","Kate Vincent","In the media"
"Teaching in Africa: A handful of educators struggles to bring order to the chaos of under-equipped schools","Nakasozi Madrasa Pre-School in Kampala. Beginning as a pilot project with one initial community pre-school, the Madrasa Programme has spawned the establishment of over 200 community pre-schools in East Africa, affecting tens of thousands of children. ","AKDN/Zahur Ramji","In the media"
"""Aga Khan speaks out on understanding of Muslims""","His Highness the Aga Khan.","AKDN / Gary Otte","In the media"
"River Deep, Mountain High","","","In the media"
"""Islam is a faith of reason""","His Highness the Aga Khan.","AKDN / Gary Otte","In the media"
"One on One: Interview with Peter Mansbridge","His Highness the Aga Khan.","AKDN / Gary Otte","In the media"
"A prince of the Islamic world","","","In the media"
"Private sector role in Afghanistan's uplift underlined","","","In the media"
"First telemedicine system launched in Afghanistan","State-of-the-art hospital in Kabul, Afghanistan.","AKDN / Sandra Calligaro","In the media"
"Stunning debut for Toronto-bound treasures","Artist-rendering of the Aga Khan Museum and their park, situated along Wynford Drive adjacent to the Don Valley Parkway in Toronto.","Imara Wynford Drive    ","In the media"
"Works of art from the Aga Khan's collection on showin London","","","In the media"
"Looking Beyond the Cities","","","In the media"
"Aga Khan opens architectural landmark","","","In the media"
"Aga Khan holds up Canada as model for the world","His Highness the Aga Khan.","AKDN / Gary Otte","In the media"
"Aga Khan prize doubled to US$1 million","His Highness the Aga Khan speaking to the assembled guests at the Aga Khan Award for Architecture ceremony, held at the Museum of Islamic Art in Doha, Qatar. Photo: AKDN / Gary Otte
سمو الآغا خان يتحدث إلى الضيوف خلال حفل توزيع جائزة الآغا خان للعمارة الذي أقيم في الدوحة، قطر.
تصوير غاري أوتي، شبكة الآغا خان للتنمية","","In the media"
"Pluralism of palette","A 15th / 16th century muqarna from Spain mounted over a floor-mounted mirror that enables viewers to examine the architectural element in a new way.","AKDN / Alex Moi","In the media"
"Aga Khan, EAC sign agreement on development","His Highness the Aga Khan and Ambassador Richard Sezibera, Secretary General of the East African Community, exchange folders and share congratulations during the signing ceremony.
 ","AKDN / Zahur Ramji","In the media"
"Aga Khan Trust: Good for people and the planet","The Park is designed to offer large open spaces for leisure and educational activities for the general public, school groups and tourists.","AKTC","In the media"
"Invest in young children to build a stronger society","Through its Madrasa Early Childhood Programme, AKF supports the creation of locally owned early childhood centres. Established in Uganda in 1993, the programme supports poor communities, managing and owning sustainable quality pre-schools that offer holistic development opportunities to young children.","AKDN/Zul Mukhida ","In the media"
"The Aga Khan University Hospital (AKUH) can now detect genetic disorders in newborns","At the AKU campus in Karachi, Pakistan, AKU researchers work on subjects including the genetic predisposition to disease (for early detection and treatment) and the major causes of infant mortality.","AKDN / Gary Otte","In the media"
"His Highness the Aga Khan: A Life in the Service of Development","His Highness the Aga Khan.","AKDN / Gary Otte","In the media"
"Karim Aga Khan and His Work","","","In the media"
"Restored Citadel of Herat poignant reminder of past Afghan glory","The Citadel of Herat - Afghanistan","AKDN","In the media"
"A journey into the Past on the Notes of Ancient Music","","","In the media"
"Bujagali set to open next month","The Bujagali Hydropower project, which now supplies almost 50 percent of the electricity of Uganda.","AKDN","In the media"
"Interview with the Aga Khan: How East Africans can build one common destiny for and by themselves, step by intelligent step","His Highness the Aga Khan.","AKDN / Gary Otte","In the media"
"Escapade gourmande au Mali","","","In the media"
"Spirit of Community","The Al-Azhar Park, Cairo, Egypt. ","","In the media"
"Towards a Happier State: Many NGOs are helping Bihar bring in change","The Aga Khan Foundation helps communities post-earthquake with reconstruction and rehabilitation efforts through rural development, education, health and water and sanitation activities. In Kutch, India, a group of women in the class are seated on the floor learning about health issues. ","Amit Pasricha ","In the media"
"Afghan Enclave Seen as Model for Development","On a map of the village, women indicate  whether they receive an adequate supply of  electricity from the new mini-hydroelectric generator – one of the two development projects they came to audit.","AKDN","In the media"
"Uganda: Bujagali dam work starts","Bujagali Energy Limited (BEL) was set up as a public-private partnership bringing together the Government of Uganda, Industrial Promotion Services (the infrastructure arm of the Aga Khan Fund for Economic Development), Sithe Global (a company majority-owned by the Blackstone Group) and Jubilee Insurance. ","AKDN","In the media"
"Aga Khan Trust revives the Middle Ages","Carpentry workshop in Darb al-Ahmar","AKDN / Matjaz Kacicnik","In the media"
"Le trophée hors normes des murs d'islam","Recipients of the ninth cycle of the Award with Prime Minister Dr. Manmohan Singh and His Highness the Aga Khan (last row, left). ","AKDN / Gary Otte","In the media"
"Monumental magic at Aga Khan Awards","2004 AKAA Ceremony","AKDN/Garry Otte","In the media"
"Aga Khan Award for Architecture Goes to Turkey","","","In the media"
"Cairo digs into its past to give Park-Starved Residents an  Oasis","The Al-Azhar Park, Cairo, Egypt. ","","In the media"
"The Spirit Behind the Aga Khan Awards","Musicians from Afghanistan and Tajikistan playing at the 2004 Aga Khan Award for Architecture Ceremony (at Humayun's Tomb). ","AKDN/Garry Otte","In the media"
"Reclaiming lost musical legacy","Homayun Sakhi playing rubab. ","Kate Vincent","In the media"
"Old Cairo transformed by park project","Aerial view of Al-Azhar Park.","AKCS-E","In the media"
"In a decaying Cairo quarter, a vision of green and renewal","Carpentry workshop in Darb al-Ahmar","AKDN / Matjaz Kacicnik","In the media"
"Paradise is a garden, and Cairo now has its own","Aerial view of Al-Azhar Park.","AKCS-E","In the media"
"Ancient voices of the steppes","","","In the media"
"Yurts and yakkety yaks","Performances and rehearsals for AKMICA English National Opera concert ","AKDN/Gary Otte","In the media"
"""There's No Conflict Between Islam and Democracy""","His Highness the Aga Khan.","AKDN / Gary Otte","In the media"
"Blooming in Cairo","The Al-Azhar Park, Cairo, Egypt. ","","In the media"
"Des pavés recyclés contre le fléau des déchets à Mopti","A series of large basins have been built along the perimeter of the mosque in which to prepare the earthen mixture to be used to bond the bricks and plaster the exterior walls.","","In the media"
"Water into Wires","An irrigation channel, pipe siphon and land development project of the Aga Khan Rural Support Programme (AKRSP) in Narthang, Baltistan (Pakistan). Planting of poplar trees is the first stage of land development after irrigation channels have been built, transforming the desert landscape.  ","Robin Oldacre-Reed ","In the media"
"Living under the Crescent Moon at IVAM","","","In the media"
"Aga Khan Award for Architecture 2004","Concert at Humayun's Tomb, 2004 Aga Khan Award for Architecture Ceremony. ","AKDN/Garry Otte","In the media"
"Lavish ceremony celebrates visionary design","","","In the media"
"46 Graduate in First Fete for Aga Khan Varsity","In 2005, the AKU Hospital, Nairobi, was created as a teaching hospital. Postgraduate medical education is already in place, in Nairobi and Dar es Salaam. The Hopital's aim is to be a premier tertiary care facility for Eastern Africa. Convocation.","Gary Otte / AKDN ","In the media"
"Broadband infrastructure progressing well","","SeaCom","In the media"
"La mosquée de Djingareyber - Tombouctou, Mali","The restoration works carried out between November 2004 and June 2006 were conducted in strict observance of traditional construction techniques. Further initiatives of this kind are planned, notably in Djenné and Timbuktu.","","In the media"
"Best of Asia 2008: The Wakhan Corridor","","","In the media"
"The French government, the Afghan government and the Aga Khan sign a letter of intent on medical projects in Afghanistan","FMIC hospital building.","","In the media"
"Why the world needs more Canada","An irrigation channel, pipe siphon and land development project of the Aga Khan Rural Support Programme (AKRSP) in Narthang, Baltistan (Pakistan). Planting of poplar trees is the first stage of land development after irrigation channels have been built, transforming the desert landscape.  ","Robin Oldacre-Reed ","In the media"
"Aid to a remote part of Pakistan","","","In the media"
"Foundation helped her, now she walks for them","","","In the media"
"Aga-Khan Schools celebrate centenary","AKES operates some 19 schools of high quality in East Africa, catering to some 9,100 students and employing about 600 teachers. 
","AKDN / Zul Mukhida","In the media"
"L´Afrique de l´Ouest a reçu la visite de l´Aga Khan","","","In the media"
"Ancient European music meets Central Asian masters","Sirojiddin Juraev from Tajikistan, Badiaa Bou Hreizi from Tunisia, and Rebal Alkhodri from Syria. The 6th Remix music workshop, Aswan, Egypt. ","Yahya Diwer","In the media"
"Market in the Park","","","In the media"
"Firm Helping Small-Scale Farmers Penetrate EU Markets","","","In the media"
"Aga Khan helicopters head for Asia","Focus Humanitarian Assistance and The Aga Khan Foundation (AKF) coordinated and assisted emergency relief operations following the earthquake that hit northern Pakistan in October 2005.","Carlino Luca, Karen SA ","In the media"
"Best of Asia: Best Restored Treasure: Baltit Fort, Hunza Valley, Pakistan","","","In the media"
"Hill forts restored in the Himalayas","","","In the media"
"Aga Khan to Expand Microfinance","","","In the media"
"Egypt gets its own ""central park""","The Al-Azhar Park, Cairo, Egypt. ","","In the media"
"Doomed Domes","The Quli Qutb Shah Archaeological Park includes 70 structures, encompassing 40 mausoleums, 23 mosques, five step-wells/water structures, a hamam (mortuary bath), pavilions, garden structures and enclosure walls built during the reign of the Qutb Shahi Dynasty that ruled the Hyderabad region for 170 years in the 16th and 17th centuries.","AKTC / India","In the media"
"Pakistani nurse wins global award for excellence in neonatal nursing","","","In the media"
"FMFB Client Wins “Best National MicroEntrepreneur” Award","The outside of the Aga Khan Agency for Microfinance Bank in Khaplu, closed after banking hours. The First MicroFinanceBank Ltd. of Pakistan started operations in May 2002 and is gradually expanding to rural and urban areas in the country. AKAM's microfinance banks offer a range of credit and savings products, payment services, money transfer, leasing and micro-insurance. They reach out to disadvantaged populations, which are currently not able to receive financial services from commercial banks. Specific emphasis is placed on vulnerable groups, women in particular. ","AKDN/Robin Oldacre-Reed","In the media"
"Bone tumour cases treated without surgery","Founded by His Highness the Aga Khan and chartered in 1983 as Pakistan's first private university, Aga Khan University's (AKU) objective is to promote human welfare in general, and the welfare of the people of Pakistan in particular, by disseminating knowledge and providing instruction, training, research and service in the health sciences, education and such other branches of learning as the University may determine. ","AKDN/Garry Otte","In the media"
"Walled City: New GIS developed to aid conservation work","Maryam Zamani mosque ","AKDN/Garry Otte","In the media"
"Safe Drinking Water Supply and Sanitation projects inaugurated in Gilgit-Baltistan and Chitral","Rahimabad, Gilgit, Pakistan. ","AKDN / Jean-Luc Ray","In the media"
"Illuminating the roof of the world: Tajikistan exports hydroelectricity to Afghan Badakshan","PamirEnergy, a project company of the Aga Khan Fund for Economic Development, is operating all power generation, transmission and distribution facilities of GBAO under a 25-year concession agreement with the Government of Tajikistan. In its initial phase PamirEnergy doubled the installed capacity at the Pamir I power plant, enabling most of the plant’s Khorog customers to have electricity 24 hours a day for the first time since the end of the Soviet era. Now cross-border transmission lines between Tajikistan and Afghanistan enable PamirEnergy to also export surplus power to Shugnan, Afghanistan and Afghan Ishkashim. ","AKDN / Jean-Luc Ray","In the media"
"Acumen fund announces first energy investment in Pakistan","Wide view of the Shandur Pass plateau, between Gilgit and Chitral districts","AKDN/Jean-Luc Ray","In the media"
"AKU inaugurates new patient-care building","Founded by His Highness the Aga Khan and chartered in 1983 as Pakistan's first private university, Aga Khan University's (AKU) objective is to promote human welfare in general, and the welfare of the people of Pakistan in particular, by disseminating knowledge and providing instruction, training, research and service in the health sciences, education and such other branches of learning as the University may determine. ","AKDN/Garry Otte","In the media"
"Aga Khan Award for Architecture shortlist announced","The global need for housing includes millions refugees and displaced persons - victims of natural disasters and wars.","","In the media"
"Mobile Afghanistan: How a national telecom network delivers social goods","A satellite dish in the grounds of the Network Management Centre, PTT building, where a group of employees work with a state-of-the-art system to ensure communication links ","AKDN/Jean-Luc Ray ","In the media"
"Public Library inaugurated in Faizabad, Afghanistan","In the Bamyan province, AKDN has implemented a range of interventions aimed both at strengthening the Afghan Government's capacity to deliver quality education, and at supporting, enhancing and promoting educational access and quality learning opportunities for all children, particularly girls","AKDN / Caroline Arnold","In the media"
"Japan assists recovery from natural disaster in Vanj district","In high mountain areas of Badakhshan,Tajikistan, FOCUS works with local communities to build irrigation channels, pathways, and other structural mitigation projects to protect communities from the effects of avalanches, flooding, mud slides and rock falls.","FOCUS","In the media"
"Mughal-era serai to be conserved","Conservation and nursery developement works in Sunder Nursery ","AKDN/Ram Rahman ","In the media"
"Réouverture du parc zoologique de Bamako : 12 milliards de Fcfa injectés par le réseau Aga Khan","Zoo National du Mali. ","AKDN / Ibai Rigby","In the media"
"Women empowerment: Chronicles of carpentry","Ciqam carpentry workshop in Altit Hunza, Pakistan.","AKDN","In the media"
" Norway signs programme with AKFP for healthcare in KP ","AKHS doctors giving a dose of iodinated oil as next takers register with volunteers. Chitral, Pakistan","AKDN/Jean-Luc Ray ","In the media"
"AAR Japan, Dushanbe Serena Hotel complete vocational cooking training for PWDs","Front entrance of the newly inaugurated Dushanbe Serena Hotel in Tajikistan.","AKDN / Gary Otte","In the media"
"Aga Khan lauded for attracting investors","His Highness the Aga Khan addresses the gathering at the inauguration of the Bujagali power plant.","AKDN / Gary Otte","In the media"
"University of Central Asia and Ministry of Finance sign MoU to deliver Certificate in Policy Analysis to Afghan civil servants","","","In the media"
"France, AKCSP extends projects on NAs","Located in Shigar Valley, in the Karakoram Mountains of northern Pakistan, the Shigar Fort Residence was restored by the Aga Khan Cultural Services Pakistan (AKCSP), the Pakistan arm of the Historic Cities Support Programme (HCSP) of the Aga Khan Trust for Culture (AKTC).  ","Christian Richters ","In the media"
